{
  "$schema": "https://json-schema.org/draft/2020-12/schema",
  "title": "Reviewed public AI workbench catalogue",
  "type": "object",
  "additionalProperties": false,
  "required": [
    "schemaVersion",
    "scope",
    "artifacts",
    "websites",
    "tasks",
    "statusSnapshot"
  ],
  "properties": {
    "schemaVersion": {
      "const": 3
    },
    "scope": {
      "type": "string",
      "minLength": 1
    },
    "artifacts": {
      "type": "array",
      "items": {
        "$ref": "#/$defs/record"
      }
    },
    "websites": {
      "type": "array",
      "items": {
        "allOf": [
          {
            "$ref": "#/$defs/record"
          },
          {
            "properties": {
              "type": {
                "const": "website"
              }
            }
          }
        ]
      }
    },
    "tasks": {
      "type": "array",
      "items": {
        "$ref": "#/$defs/task"
      }
    },
    "statusSnapshot": {
      "type": "object",
      "additionalProperties": false,
      "required": [
        "mode",
        "asOf",
        "notice",
        "items",
        "coverage",
        "decisions",
        "staleAfterMinutes",
        "publicationChecks"
      ],
      "properties": {
        "mode": {
          "const": "snapshot"
        },
        "asOf": {
          "type": "string",
          "format": "date-time"
        },
        "notice": {
          "type": "string",
          "minLength": 1
        },
        "items": {
          "type": "array",
          "minItems": 8,
          "maxItems": 8,
          "items": {
            "type": "object",
            "additionalProperties": false,
            "required": [
              "id",
              "number",
              "title",
              "state",
              "currentAction",
              "waitingFor",
              "verifiedAt",
              "publication",
              "completion",
              "links",
              "projectIds",
              "contextMessageIds",
              "access",
              "metadataApproved",
              "verification"
            ],
            "properties": {
              "id": {
                "type": "string",
                "pattern": "^task-[1-8]$"
              },
              "number": {
                "type": "integer",
                "minimum": 1,
                "maximum": 8
              },
              "title": {
                "type": "string",
                "minLength": 1
              },
              "state": {
                "enum": [
                  "running",
                  "waiting",
                  "blocked",
                  "round_complete"
                ]
              },
              "currentAction": {
                "type": "string",
                "minLength": 1
              },
              "waitingFor": {
                "type": "string",
                "minLength": 1
              },
              "verifiedAt": {
                "type": "string",
                "format": "date-time"
              },
              "publication": {
                "type": "string",
                "minLength": 1
              },
              "completion": {
                "type": "string",
                "minLength": 1
              },
              "links": {
                "type": "array",
                "minItems": 1,
                "maxItems": 3,
                "items": {
                  "type": "object",
                  "additionalProperties": false,
                  "required": [
                    "label",
                    "url"
                  ],
                  "properties": {
                    "label": {
                      "type": "string",
                      "minLength": 1
                    },
                    "url": {
                      "type": "string",
                      "pattern": "^(https://|\\.\\./|#)"
                    }
                  }
                }
              },
              "projectIds": {
                "type": "array",
                "minItems": 1,
                "items": {
                  "type": "string",
                  "minLength": 1
                }
              },
              "access": {
                "const": "public"
              },
              "metadataApproved": {
                "const": true
              },
              "contextMessageIds": {
                "type": "array",
                "minItems": 1,
                "items": {
                  "type": "string",
                  "pattern": "^Sentinel_[a-z0-9]+$"
                }
              },
              "verification": {
                "type": "object",
                "additionalProperties": false,
                "required": [
                  "kind",
                  "summary",
                  "observedAt",
                  "links"
                ],
                "properties": {
                  "kind": {
                    "enum": [
                      "project_check",
                      "public_release"
                    ]
                  },
                  "summary": {
                    "type": "string",
                    "minLength": 1
                  },
                  "observedAt": {
                    "type": [
                      "string",
                      "null"
                    ],
                    "format": "date-time"
                  },
                  "links": {
                    "type": "array",
                    "maxItems": 3,
                    "items": {
                      "type": "object",
                      "additionalProperties": false,
                      "required": [
                        "label",
                        "url"
                      ],
                      "properties": {
                        "label": {
                          "type": "string",
                          "minLength": 1
                        },
                        "url": {
                          "type": "string",
                          "pattern": "^(https://|\\.\\./|#)"
                        }
                      }
                    }
                  }
                }
              }
            }
          }
        },
        "coverage": {
          "type": "object",
          "additionalProperties": false,
          "required": [
            "messageCount",
            "nonemptyCount",
            "end",
            "partial",
            "summary"
          ],
          "properties": {
            "messageCount": {
              "type": "integer",
              "minimum": 0
            },
            "nonemptyCount": {
              "type": "integer",
              "minimum": 0
            },
            "end": {
              "type": "string",
              "format": "date-time"
            },
            "partial": {
              "type": "boolean"
            },
            "summary": {
              "type": "string",
              "minLength": 1
            }
          }
        },
        "decisions": {
          "type": "array",
          "items": {
            "type": "object",
            "additionalProperties": false,
            "required": [
              "title",
              "summary",
              "messageId",
              "supersedes"
            ],
            "properties": {
              "title": {
                "type": "string",
                "minLength": 1
              },
              "summary": {
                "type": "string",
                "minLength": 1
              },
              "messageId": {
                "type": "string",
                "minLength": 1
              },
              "supersedes": {
                "type": "array",
                "items": {
                  "type": "string",
                  "minLength": 1
                }
              }
            }
          }
        },
        "staleAfterMinutes": {
          "const": 30
        },
        "publicationChecks": {
          "type": "object",
          "additionalProperties": false,
          "required": [
            "checkedAt",
            "source",
            "mirror",
            "status"
          ],
          "properties": {
            "checkedAt": {
              "type": "string",
              "format": "date-time"
            },
            "source": {
              "type": "object",
              "additionalProperties": false,
              "required": [
                "version",
                "commit",
                "deployedAt",
                "runId",
                "runUrl"
              ],
              "properties": {
                "version": {
                  "type": "string",
                  "pattern": "^[0-9]+\\.[0-9]+\\.[0-9]+$"
                },
                "commit": {
                  "type": "string",
                  "pattern": "^[a-f0-9]{40}$"
                },
                "deployedAt": {
                  "type": "string",
                  "format": "date-time"
                },
                "runId": {
                  "type": "integer",
                  "minimum": 1
                },
                "runUrl": {
                  "type": "string",
                  "pattern": "^https://github\\.com/1337816143/MyDotWork/actions/runs/[0-9]+$"
                }
              }
            },
            "mirror": {
              "type": "object",
              "additionalProperties": false,
              "required": [
                "version",
                "upstreamCommit",
                "sourceCommit",
                "commit",
                "syncedAt",
                "deployedAt",
                "runId",
                "runUrl"
              ],
              "properties": {
                "version": {
                  "type": "string",
                  "pattern": "^[0-9]+\\.[0-9]+\\.[0-9]+$"
                },
                "upstreamCommit": {
                  "type": "string",
                  "pattern": "^[a-f0-9]{40}$"
                },
                "sourceCommit": {
                  "type": "string",
                  "pattern": "^[a-f0-9]{40}$"
                },
                "commit": {
                  "type": "string",
                  "pattern": "^[a-f0-9]{40}$"
                },
                "syncedAt": {
                  "type": "string",
                  "format": "date-time"
                },
                "deployedAt": {
                  "type": "string",
                  "format": "date-time"
                },
                "runId": {
                  "type": "integer",
                  "minimum": 1
                },
                "runUrl": {
                  "type": "string",
                  "pattern": "^https://github\\.com/1337816143/Evolution/actions/runs/[0-9]+$"
                }
              }
            },
            "status": {
              "const": "consistent"
            }
          }
        }
      }
    }
  },
  "$defs": {
    "record": {
      "type": "object",
      "additionalProperties": false,
      "required": [
        "id",
        "title",
        "type",
        "task",
        "url",
        "updatedAt",
        "summary",
        "access",
        "metadataApproved"
      ],
      "properties": {
        "id": {
          "type": "string",
          "pattern": "^[a-z0-9-]+$"
        },
        "title": {
          "type": "string",
          "minLength": 1
        },
        "type": {
          "enum": [
            "report",
            "dataset",
            "tutorial",
            "guide",
            "archive",
            "website",
            "progress"
          ]
        },
        "task": {
          "type": "string",
          "minLength": 1
        },
        "url": {
          "type": "string",
          "minLength": 1,
          "pattern": "^(https://|\\.\\./|#)"
        },
        "updatedAt": {
          "anyOf": [
            {
              "type": "string",
              "format": "date"
            },
            {
              "type": "string",
              "format": "date-time"
            },
            {
              "type": "null"
            }
          ]
        },
        "summary": {
          "type": "string",
          "minLength": 1
        },
        "access": {
          "enum": [
            "public",
            "login"
          ]
        },
        "metadataApproved": {
          "const": true
        }
      }
    },
    "task": {
      "type": "object",
      "additionalProperties": false,
      "required": [
        "id",
        "projectIndex",
        "expectedTitle",
        "metadataApproved",
        "access"
      ],
      "properties": {
        "id": {
          "type": "string",
          "minLength": 1
        },
        "projectIndex": {
          "type": "integer",
          "minimum": 1
        },
        "expectedTitle": {
          "type": "string",
          "minLength": 1
        },
        "metadataApproved": {
          "const": true
        },
        "access": {
          "enum": [
            "public",
            "login"
          ]
        }
      }
    }
  }
}
