{
  "schemaVersion": 3,
  "scope": "仅明确公开或明确授权公开元数据的成果；不自动扫描对话、Library或本机目录。",
  "artifacts": [
    {
      "id": "upstream-round1",
      "title": "AI上游调研 · 第一轮完整报告",
      "type": "report",
      "task": "project-1",
      "url": "../research/2026-10-02.html",
      "updatedAt": "2026-10-02T06:18:00Z",
      "summary": "ChatGPT Go/Plus/Pro等45条供货SKU、成品号核查与Claude Code资料，保留原始证据。",
      "access": "public",
      "metadataApproved": true
    },
    {
      "id": "upstream-round2",
      "title": "经营资格与发票 · 第二轮专项核查",
      "type": "report",
      "task": "project-1",
      "url": "../research/2026-10-02-round2.html",
      "updatedAt": "2026-10-02T06:38:00Z",
      "summary": "9家票据候选、11条采购经营路线；商家声明、实际收款与验真分开。",
      "access": "public",
      "metadataApproved": true
    },
    {
      "id": "round1-data",
      "title": "第一轮研究数据 JSON",
      "type": "dataset",
      "task": "project-1",
      "url": "../research/2026-10-02.json",
      "updatedAt": "2026-10-02T06:18:00Z",
      "summary": "结构化原始研究快照，不把商称报价视为成交。",
      "access": "public",
      "metadataApproved": true
    },
    {
      "id": "round2-data",
      "title": "第二轮研究数据 JSON",
      "type": "dataset",
      "task": "project-1",
      "url": "../research/2026-10-02-round2.json",
      "updatedAt": "2026-10-02T06:38:00Z",
      "summary": "票据候选、采购路线与修正证据的结构化快照。",
      "access": "public",
      "metadataApproved": true
    },
    {
      "id": "historical-supply",
      "title": "ChatGPT供货库 · 历史126条基线",
      "type": "report",
      "task": "project-1",
      "url": "https://1337816143.github.io/MyDotWork/",
      "updatedAt": "2026-10-01",
      "summary": "独立历史基线，不覆盖当前新证据。",
      "access": "public",
      "metadataApproved": true
    },
    {
      "id": "claude-tutorial",
      "title": "Claude Code · 新手使用教程",
      "type": "tutorial",
      "task": "project-1",
      "url": "#tutorial",
      "updatedAt": "2026-10-02T06:18:00Z",
      "summary": "官方文档步骤与Windows入门，区别会员额度、API和云渠道。",
      "access": "public",
      "metadataApproved": true
    },
    {
      "id": "account-troubleshooting",
      "title": "账号与手机验证 · 排障入口",
      "type": "guide",
      "task": "project-1",
      "url": "#troubleshooting",
      "updatedAt": "2026-10-02T06:18:00Z",
      "summary": "普通登录、MFA、Codex/API和手机注册分别排查。",
      "access": "public",
      "metadataApproved": true
    },
    {
      "id": "public-chat-archive",
      "title": "已公开聊天归档 · 覆盖说明与原文",
      "type": "archive",
      "task": "project-4",
      "url": "../chat/index.html",
      "updatedAt": "2026-10-04T14:27:08.445814+00:00",
      "summary": "567条已授权公开记录，其中556条有文字；60条本批增量按真实ID核验，旧507条保持。部分分页，附件与其他会话全文不公开。",
      "access": "public",
      "metadataApproved": true
    },
    {
      "id": "public-project-data",
      "title": "已公开项目进度 JSON",
      "type": "dataset",
      "task": "project-4",
      "url": "../projects/status.json",
      "updatedAt": "2026-10-04T15:09:00Z",
      "summary": "18项项目与九项当前任务对应的进度快照；区分发布、运行状态和未解决需求。",
      "access": "public",
      "metadataApproved": true
    },
    {
      "id": "upstream-round3-7",
      "title": "AI上游研究 · 第3—8轮与票据授权核验",
      "type": "report",
      "task": "project-1",
      "url": "../research/round3-7/report.html",
      "updatedAt": "2026-10-03",
      "summary": "9个证据章节、273个去重来源URL和30条历史报价；追加7家主体/票项/转售权矩阵，32条本轮来源含复读与未取得正文项，合格候选仍为空。",
      "access": "public",
      "metadataApproved": true
    },
    {
      "id": "upstream-round3-7-data",
      "title": "第3—8轮与票据授权核验 · 数据 JSON",
      "type": "dataset",
      "task": "project-1",
      "url": "../research/round3-7/ai-upstream-public.json",
      "updatedAt": "2026-10-03",
      "summary": "旧8章与30条历史报价完整保留，追加7家询证清单与税务查验边界；273个URL仅为目录总数，不等于净新有效证据或已验真发票。",
      "access": "public",
      "metadataApproved": true
    },
    {
      "id": "side-income-report",
      "title": "AI副业调研 · 低维护产品与自由接单 v1.4",
      "type": "report",
      "task": "project-17",
      "url": "../research/ai-side-income/report.html",
      "updatedAt": "2026-10-03",
      "summary": "32类方向、153个公开来源；保留v0.1，新增同一C10样品v0.2候选及兼容验收表。程序与Writer检查通过，Excel/Calc及商业验证仍未完成。",
      "access": "public",
      "metadataApproved": true
    },
    {
      "id": "side-income-data",
      "title": "AI副业调研 · 结构化资料 JSON v1.4",
      "type": "dataset",
      "task": "project-17",
      "url": "../research/ai-side-income/data.json",
      "updatedAt": "2026-10-03",
      "summary": "与完整报告相同的方案、假设成本、平台条件、样品边界和证据；公开市场信号不等于本人收益。",
      "access": "public",
      "metadataApproved": true
    },
    {
      "id": "side-income-sample-v01",
      "title": "科研证据矩阵到提纲 · 样品与执行清单成果包 v0.1",
      "type": "archive",
      "task": "project-17",
      "url": "../research/ai-side-income/sample-v0.1.zip",
      "updatedAt": "2026-10-03",
      "summary": "66,163字节完整成果包，含53,012字节核心样品、执行清单和产品规格；仅供原创评估及内部试用，正式许可与售后仍为草案，未验证付费需求。",
      "access": "public",
      "metadataApproved": true
    },
    {
      "id": "side-income-sample-v02-candidate",
      "title": "科研证据矩阵 · 原创评估样品 v0.2候选",
      "type": "archive",
      "task": "project-17",
      "url": "../research/ai-side-income/sample-v0.2-candidate.zip",
      "updatedAt": "2026-10-03",
      "summary": "60,354字节候选包，修正空白、缺失与重复ID提示，关联范围扩至200行；21项程序检查及Writer原生编辑保存通过，Excel/Calc原生重算未验，无真实客户或收入证据。",
      "access": "public",
      "metadataApproved": true
    },
    {
      "id": "supplier-review-20261003",
      "title": "五家供货候选 · 完整复核与证据缺口",
      "type": "report",
      "task": "project-1",
      "url": "../research/2026-10-03/index.html#supplier-original",
      "updatedAt": "2026-10-03T13:20:00Z",
      "summary": "五家既有候选19条访问记录、18个URL；含1次读取失败，合格含票授权闭环仍为0。",
      "access": "public",
      "metadataApproved": true
    },
    {
      "id": "supplier-review-data-20261003",
      "title": "五家供货复核 · 原结构化数据",
      "type": "dataset",
      "task": "project-1",
      "url": "../research/2026-10-03/supplier-review.json",
      "updatedAt": "2026-10-03T13:20:00Z",
      "summary": "保留原价格日期、退款条款与S01–S19来源；观察数量不等于新增供应商。",
      "access": "public",
      "metadataApproved": true
    },
    {
      "id": "task35-current-plan-20261003",
      "title": "任务3／5 · 现行方案完整原文",
      "type": "guide",
      "task": "project-17",
      "url": "../research/2026-10-03/task35-current-plan.txt",
      "updatedAt": "2026-10-03T19:14:00Z",
      "summary": "5秒预演仅待验证假设；旧方案保留历史，未试听、许可与需求待证，私人媒体不公开。",
      "access": "public",
      "metadataApproved": true
    },
    {
      "id": "task35-evidence-gates-20261003",
      "title": "任务3／5 · 当前证据门槛与完整材料",
      "type": "report",
      "task": "project-17",
      "url": "../research/2026-10-03/index.html",
      "updatedAt": "2026-10-03T19:14:00Z",
      "summary": "区分采购全费上限、未知利润和真实订单；完整保留供货原报告与现行方案，审校不刷新观察日期。",
      "access": "public",
      "metadataApproved": true
    },
    {
      "id": "task35-evidence-data-20261003",
      "title": "任务3／5 · 证据门槛结构化记录",
      "type": "dataset",
      "task": "project-17",
      "url": "../research/2026-10-03/evidence-gates.json",
      "updatedAt": "2026-10-03T19:14:00Z",
      "summary": "五家票费与全费保持null；S01仅单次样本，无需求、客户、收入或低维护盈利的验证。",
      "access": "public",
      "metadataApproved": true
    },
    {
      "id": "supplier-delta-20261004",
      "title": "供货定点补证 · 10月4日",
      "type": "report",
      "task": "project-1",
      "url": "../research/2026-10-04/index.html",
      "updatedAt": "2026-10-04T02:46:00Z",
      "summary": "五家25条来源复读；ChatShare准确SKU重读与Claude身份规则细化。未知票费、含票全费及授权缺口保留。",
      "access": "public",
      "metadataApproved": true
    },
    {
      "id": "supplier-delta-data-20261004",
      "title": "供货补证结构化观察 · 10月4日",
      "type": "dataset",
      "task": "project-1",
      "url": "../research/2026-10-04/supplier-delta.json",
      "updatedAt": "2026-10-04T02:46:00Z",
      "summary": "准确SKU、公开来源、观察时间、证据边界及未知费用；保留历史日期，不把复读算净新增。",
      "access": "public",
      "metadataApproved": true
    },
    {
      "id": "vector-validation-20261004",
      "title": "实时手势VFX · 发布与验证边界",
      "type": "dataset",
      "task": "project-15",
      "url": "../projects/vector-2026-10-04.json",
      "updatedAt": "2026-10-04T05:05:52Z",
      "summary": "v0.10.1精确提交、四指尖窗口和合成媒体验证；真实硬件与蜘蛛侠效果未验收。",
      "access": "public",
      "metadataApproved": true
    },
    {
      "id": "business-validation-20261004",
      "title": "AI副业 · 需求与成本验证",
      "type": "report",
      "task": "project-17",
      "url": "../research/2026-10-04/task5-business-validation-20261004.html",
      "updatedAt": "2026-10-04T12:26:00Z",
      "summary": "历史需求、优酷新规、许可与39/59/99元假设成本敏感性；订单与收入仍为0。",
      "access": "public",
      "metadataApproved": true
    },
    {
      "id": "business-validation-text-20261004",
      "title": "AI副业 · 完整文字TXT",
      "type": "guide",
      "task": "project-17",
      "url": "../research/2026-10-04/task5-business-validation-20261004.txt",
      "updatedAt": "2026-10-04T12:26:00Z",
      "summary": "可下载完整文字与来源，不含私有视频或媒体。",
      "access": "public",
      "metadataApproved": true
    },
    {
      "id": "business-validation-data-20261004",
      "title": "AI副业 · 证据与计算JSON",
      "type": "dataset",
      "task": "project-17",
      "url": "../research/2026-10-04/task5-business-validation-20261004-evidence.json",
      "updatedAt": "2026-10-04T12:26:00Z",
      "summary": "明确历史需求、假设费用与未知实测成本；延伸机器耗时不作为验证结论。",
      "access": "public",
      "metadataApproved": true
    },
    {
      "id": "vector-validation-v0111",
      "title": "Vector v0.11.1 · 面罩与生命周期验证",
      "type": "dataset",
      "task": "project-15",
      "url": "../projects/vector-0.11.1-2026-10-04.json",
      "updatedAt": "2026-10-04T14:59:29.563825+00:00",
      "summary": "58项测试与5个线上文件哈希；VP9颜色容差、x64失败和真实设备边界分别记录。",
      "access": "public",
      "metadataApproved": true
    },
    {
      "id": "smartdrop-r1-validation",
      "title": "SmartDrop R1 · 离线核心与指南",
      "type": "dataset",
      "task": "project-14",
      "url": "../projects/smartdrop-r1-2026-10-04.json",